<?xml version="1.0" encoding="UTF-8" ?>

<FRechnung xmlns:xsi="http://www.w3.org/2001/XMLSchema-instance"
           xsi:noNamespaceSchemaLocation="rechnung.xsd">
    <Rechnung>
        <Tag></Tag>
        <Kontakt>
            <Empfaenger>
                <Adresse>
                    <Anrede>Dr. med.</Anrede>
                    <Name>Cyprian Zottel</Name>
                    <Strasse>Soddelstrudel</Strasse>
                    <Hausnummer>5a</Hausnummer>
                    <PLZ>13023</PLZ>
                    <Ort>Zotenheim</Ort>
                </Adresse>
            </Empfaenger>
            <Sender></Sender>
        </Kontakt>
        <RechnungsNummer>15124124</RechnungsNummer>
        <Positionen>
            <Pos PosNummer = "1">
                <Menge>3</Menge>
                <Produkt>Grippemittel "Tumifla"</Produkt>
                <Preis>360.0</Preis>
                <Mehrwertsteuer>19</Mehrwertsteuer>
            </Pos>
            <Pos PosNummer = "2">
                <Menge>2</Menge>
                <Produkt>Beratung pauschal</Produkt>
                <Preis>50.0</Preis>
                <Mehrwertsteuer>19</Mehrwertsteuer>
            </Pos>
            <Pos PosNummer = "3">
                <Menge>2</Menge>
                <Produkt>Abführmittel "Wech damit" pro Liter</Produkt>
                <Preis>199.98</Preis>
                <Mehrwertsteuer>19</Mehrwertsteuer>
            </Pos>
            <Pos PosNummer = "4">
                <Menge>2</Menge>
                <Produkt>Energieriegel "Sato"</Produkt>
                <Preis>11.96</Preis>
                <Mehrwertsteuer>7</Mehrwertsteuer>
            </Pos>
        </Positionen>
        <Betrag>
            <Brutto>962.22</Brutto>
            <Netto>490.22</Netto>
            <Mwst>116.74</Mwst>
        </Betrag>
        <Zahlungsart>
            <USTNummer>DE333666999</USTNummer>
        </Zahlungsart>
    </Rechnung>


    <Rechnung>
        <Tag>Kleintier Meier - Kleintierhandel</Tag>
        <Kontakt>
            <Empfaenger></Empfaenger>
            <Sender>
                <Adresse Mail="unter@berg.de">
                    <Name>Kleintier Meier GmbH</Name>
                    <Strasse>Meierring</Strasse>
                    <Hausnummer>3</Hausnummer>
                    <PLZ>81828</PLZ>
                    <Ort>Machthausen</Ort>
                    <Tel>0777987987</Tel>
                    <Fax>0777987789</Fax>
                </Adresse>
            </Sender>
        </Kontakt>
        <Steuernummer>88123/82822</Steuernummer>
        <DatumAusstellung>2017-01-15</DatumAusstellung>
        <RechnungsNummer>657321</RechnungsNummer>
        <Positionen></Positionen>
        <Betrag>
            <Brutto>962.22</Brutto>
        </Betrag>
        <Zahlungsart></Zahlungsart>
    </Rechnung>

    <Rechnung>
        <Kontakt>
            <Empfaenger>
                <Adresse>
                    <Anrede>Familie</Anrede>
                    <Name>Urmel</Name>
                    <Strasse>Ulturenstrasse</Strasse>
                    <Hausnummer>764</Hausnummer>
                    <PLZ>43210</PLZ>
                    <Ort>Ultursingen</Ort>
                </Adresse>
            </Empfaenger>
            <Sender>
                <Adresse Mail="unter@berg.de">
                    <Name>Bestattung Unterberg</Name>
                    <Strasse>Oberbergweg</Strasse>
                    <Hausnummer>5</Hausnummer>
                    <PLZ>43210</PLZ>
                    <Ort>Ultursingen</Ort>
                    <Tel>0478777555</Tel>
                </Adresse>
            </Sender>
        </Kontakt>
        <Steuernummer>DE987654321</Steuernummer>
        <DatumAusstellung>2017-10-19</DatumAusstellung>
        <RechnungsNummer>89321311</RechnungsNummer>
        <Betrag>
            <Brutto>738.23</Brutto>
            <Netto>878.49</Netto>
            <Mwst>140.26</Mwst>
        </Betrag>
        <Positionen>
            <Pos PosNummer = "1">
                <Menge>1</Menge>
                <Produkt>Urne, Eiche massiv</Produkt>
                <Preis>299.99</Preis>
                <Mehrwertsteuer>19</Mehrwertsteuer>
            </Pos>
            <Pos PosNummer = "2">
                <Menge>1</Menge>
                <Produkt>Überführung Krematorium Feuerbach</Produkt>
                <Preis>349.0</Preis>
                <Mehrwertsteuer>19</Mehrwertsteuer>
            </Pos>
            <Pos PosNummer = "3">
                <Menge>1</Menge>
                <Produkt>Dekoration</Produkt>
                <Preis>149.5</Preis>
                <Mehrwertsteuer>19</Mehrwertsteuer>
            </Pos>
            <Pos PosNummer = "3">
                <Menge>1</Menge>
                <Produkt>Dekoration</Produkt>
                <Preis>149.5</Preis>
                <Mehrwertsteuer>19</Mehrwertsteuer>
            </Pos>
            <Pos PosNummer = "4">
                <Menge>40</Menge>
                <Produkt>Trauerkarten</Produkt>
                <Preis>80.0</Preis>
                <Mehrwertsteuer>19</Mehrwertsteuer>
            </Pos>
        </Positionen>
        <Zahlungsart>
            <USTNummer>DE333666999</USTNummer>
            <KontoBank>
                <BankName>UBS Zürich</BankName>
                <KontoNummer>75847683</KontoNummer>
                <IBAN>DE16660501010077889911</IBAN>
                <BIC>UBSWCHZH80H</BIC>
            </KontoBank>
            <Bitcoin>
                <BitAdresse>1P82rBiJHDFSav2QrKx1bvdDRVh5QnGkkZ</BitAdresse>
            </Bitcoin>
        </Zahlungsart>
    </Rechnung>
    <Rechnung>
        <Kontakt>
            <Empfaenger>
                <Adresse>
                    <Anrede>Herr</Anrede>
                    <Name>Claudius Artemis</Name>
                    <Strasse>Am Wolfsweiher</Strasse>
                    <Hausnummer>7</Hausnummer>
                    <PLZ>56741</PLZ>
                    <Ort>Hirschhausen</Ort>
                </Adresse>
            </Empfaenger>
            <Sender>
                <Adresse Mail="">
                    <Anrede>Herr</Anrede>
                    <Name>Peer Weidemann</Name>
                    <Strasse>Kürschnergasse</Strasse>
                    <Hausnummer>77</Hausnummer>
                    <PLZ>76131</PLZ>
                    <Ort>Karlsgrube</Ort>
                </Adresse>
            </Sender>
        </Kontakt>
        <DatumAusstellung>2017-08-09</DatumAusstellung>
        <RechnungsNummer>1</RechnungsNummer>
        <Betrag>
            <Brutto>3598.99</Brutto>
            <Netto>3598.99</Netto>
            <Mwst>0</Mwst>
        </Betrag>
        <Positionen>
            <Pos PosNummer="1">
                <Menge>1</Menge>
                <Produkt>Bogelschnepper, um 1600</Produkt>
                <Preis>3499.00</Preis>
                <Mehrwertsteuer>0</Mehrwertsteuer>
            </Pos>
            <Pos PosNummer="2">
                <Menge>200</Menge>
                <Produkt>Schusser, um 1720</Produkt>
                <Preis>99.99</Preis>
                <Mehrwertsteuer>0</Mehrwertsteuer>
            </Pos>
        </Positionen>
        <Zahlungsart>
        </Zahlungsart>
    </Rechnung>
</FRechnung>